location,latitude,longitude,nearest_airport,full_address
Welsford,45.0870804,-64.7569673,YZX,"Welsford, Municipality of the County of Kings, Kings County, Nova Scotia, B0P 1E0, Canada"
Cowansville,45.2076125,-72.7479195,ZBM,"Cowansville, Brome-Missisquoi, Estrie, Québec, Canada"
Moose Jaw,50.401515,-105.542908,YMJ,"Moose Jaw, Division No. 7, Saskatchewan, Canada"
Selby,44.2996957,-76.9830099,YGK,"Selby, Greater Napanee, Lennox and Addington County, Eastern Ontario, Ontario, K0K 2Z0, Canada"
Sylvan Lake,52.3102136,-114.0974155,YQF,"Town of Sylvan Lake, Division No. 8, Alberta, Canada"
Claresholm,50.0239458,-113.5800285,WPC,"Claresholm, Division No. 3, Alberta, T0L 0T0, Canada"
Saint-Charles-Borromée,46.04774,-73.46283,YHU,"Saint-Charles-Borromée, Joliette (MRC), Lanaudière, Québec, Canada"
Dauphin,51.153509,-100.04425,YDN,"Dauphin, Division No. 17, Manitoba, Canada"
Saint-Raphaël-de-Bellechasse,46.7982521,-70.736494,YQB,"Barrage de Saint-Raphaël, Saint-Raphaël, Bellechasse, Chaudière-Appalaches, Québec, G0R 4C0, Canada"
Cowichan Bay,48.741701,-123.626404,YGG,"Cowichan Bay, Area D (Cowichan Bay), Cowichan Valley Regional District, British Columbia, V0R 1N0, Canada"
Saint-Paul-de-Montminy,46.7301196,-70.3611862,YQB,"Saint-Paul-de-Montminy, Montmagny (MRC), Chaudière-Appalaches, Québec, Canada"
Saint-Joseph-des-Érables,46.29349125,-70.90178427447975,YQB,"Saint-Joseph-des-Érables, Beauce-Centre, Chaudière-Appalaches, Québec, Canada"
Wikwemikong,45.8079681,-81.7122055,YEM,"Wikwemikong, Manitoulin District, Northeastern Ontario, Ontario, P0P 2J0, Canada"
Redvers,49.5727567,-101.6979903,YEN,"Redvers, Division No. 1, Saskatchewan, S0C 2H0, Canada"
Buctouche-Sud,46.4654862,-64.7075212,YQM,"Buctouche-Sud, Bouctouche, Wellington Parish, Kent County, New Brunswick / Nouveau-Brunswick, E4S 2T6, Canada"
New Sarum,42.7765507,-81.0831213,YQS,"New Sarum, Central Elgin, Elgin County, Ontario, N5P 3S7, Canada"
Orléans,45.40683715,-75.52745676171389,YRO,"Orléans, Ottawa, Eastern Ontario, Ontario, Canada"
Langley (city),49.1039289,-122.657047,YLY,"City of Langley, Metro Vancouver Regional District, British Columbia, Canada"
Swartz Bay,48.6882677,-123.4122985,YYJ,"Swartz Bay, North Saanich, Capital Regional District, British Columbia, V8L 5J4, Canada"
Middle Musquodoboit,45.0445598,-63.1468684,YHZ,"Middle Musquodoboit, Halifax Regional Municipality, Halifax County, Nova Scotia, Canada"
Charette,46.440696,-72.924156,YRQ,"Charette, Maskinongé (MRC), Mauricie, Québec, Canada"
Pierson,49.1782105,-101.2623584,MIB,"Pierson, Municipality of Two Borders, Division No. 5, Manitoba, Canada"
Killam,52.7929777,-111.8549407,YCT,"Killam (town), Alberta, T0B 2L0, Canada"
Coral Harbour,64.136455,-83.1642053,YZS,"ᓴᓪᓕᖅ Coral Harbour, ᑭᕙᓪᓕᖅ Kivalliq Region, ᓄᓇᕗᑦ Nunavut, X0C 0C0, Canada"
Saint-Anaclet,48.477018,-68.424225,YXK,"Saint-Anaclet-de-Lessard, Rimouski-Neigette, Bas-Saint-Laurent, Québec, G0K 1H0, Canada"
Chibougamau,49.9137407,-74.3713954,YMT,"Chibougamau, ᐄᔨᔨᐤ ᐊᔅᒌ ᒉᐃᒥᔅ ᐯᐃ Eeyou Istchee Baie-James, Jamésie, Nord-du-Québec, Québec, Canada"
Mill Village (Queens),44.1381168,-64.6418384,YZX,"Mill Village, Region of Queens Municipality, Queens County, Nova Scotia, B0J 2H0, Canada"
Camden East,44.3353608,-76.8332442,YGK,"Camden East, Stone Mills, Greater Napanee, Lennox and Addington County, Eastern Ontario, Ontario, K0K 1J0, Canada"
Havelock,44.305538,-65.9206037,YDG,"Havelock, Clare Municipal District, Digby County, Nova Scotia, B0W 3M0, Canada"
Emyvale,46.2783,-63.3583741,YYG,"Emyvale, Rural Municipality of Kingston, Queens County, Prince Edward Island, Canada"
"Frelighsburg, Quebec",45.056061,-72.836609,ZBM,"Frelighsburg, Brome-Missisquoi, Estrie, Québec, J0J 1C0, Canada"
Saint-Pamphile,46.961511,-69.78035,YML,"Saint-Pamphile, L'Islet (MRC), Chaudière-Appalaches, Québec, G0R 3X0, Canada"
La Prairie,45.4175472,-73.4891432,YHU,"La Prairie, Roussillon, Montérégie, Québec, Canada"
Merritt,50.1124876,-120.7884149,YKA,"Merritt, Thompson-Nicola Regional District, British Columbia, Canada"
Roxton Falls,45.5737001,-72.5214627,ZBM,"Roxton Falls, Acton, Montérégie, Québec, Canada"
Greater Sudbury,46.49272,-80.991211,YSB,"Greater Sudbury, Sudbury District, Northeastern Ontario, Ontario, Canada"
Bridgewater,44.3774134,-64.5193946,YZX,"Town of Bridgewater, Lunenburg County, Nova Scotia, Canada"
Bécancour,46.3715923,-72.1856343,YRQ,"Bécancour (MRC), Centre-du-Québec, Québec, Canada"
Wood Islands,45.9640962,-62.7512546,YYG,"Wood Islands, Rural Municipality of Belfast, Queens County, Prince Edward Island, C0A 1B0, Canada"
Margaree Forks,46.3329379,-61.0960567,YPS,"Margaree Forks, Municipality of the County of Inverness, Inverness County, Nova Scotia, Canada"
Saint-Thomas-de-Kent,46.4452697,-64.6395241,YQM,"Saint-Thomas-de-Kent, Wellington Parish, Kent County, New Brunswick / Nouveau-Brunswick, E4S 4A5, Canada"
Port aux Basques (Channel),47.58298205,-59.131415797193505,YJT,"Port aux Basques, Channel-Port aux Basques, Newfoundland, Newfoundland and Labrador, Canada"
Grey River,47.9509886,-56.9621945,MQC,"Grey River, Newfoundland, Newfoundland and Labrador, Canada"
Hamilton,43.2560802,-79.8728583,YHM,"Hamilton, Golden Horseshoe, Ontario, Canada"
Mont Ste. Marie,45.9368786,-75.86472556546207,YMW,"Mont Ste. Marie, 76, Lac-Sainte-Marie, La Vallée-de-la-Gatineau, Québec, J0X 1Z0, Canada"
Sandy Point,43.7096048,-65.3206624,YQI,"Sandy Point, Municipality of the District of Shelburne, Shelburne County, Nova Scotia, B0T 1W0, Canada"
Glaslyn,53.3608648,-108.3566354,YQW,"Glaslyn, Division No. 17, Saskatchewan, S0M 0Y0, Canada"
Radium Hot Springs,50.6200728,-116.0760592,YBA,"Radium Hot Springs, Regional District of East Kootenay, British Columbia, V0A 1M0, Canada"
Glencoe,45.9490042,-61.3267909,YPS,"Glencoe, Municipality of the County of Inverness, Inverness County, Nova Scotia, Canada"
Fredericton Road,46.0677686,-65.1711238,YQM,"Fredericton Road, Salisbury Parish, Westmorland County, New Brunswick / Nouveau-Brunswick, Canada"
Green Hill,47.2657163,-52.9529586,YYT,"Green Hill, Newfoundland, Newfoundland and Labrador, Canada"
Saint-Constant,45.3724897,-73.5704589,YUL,"Saint-Constant, Roussillon, Montérégie, Québec, Canada"
Boularderie,46.1645193,-60.5658102,YQY,"Boularderie, Ross Ferry, Municipality of Victoria County, Victoria County, Nova Scotia, Canada"
Holland Landing,44.1015097,-79.4914772,YKZ,"Holland Landing, East Gwillimbury, York Region, Golden Horseshoe, Ontario, L9N 1L8, Canada"
God's River 86A,54.8363402,-94.04646635614498,ZGI,"ᒪᓂᑐ ᓰᐱᐩ God's River 86A, ᒪᓂᑐ ᓰᐱᐩ God's River, Division No. 22, Manitoba, R0B 0N0, Canada"
Birch Island,43.7224159,-65.8627014,YQI,"Birch Island, Lower Argyle, Argyle Municipal District, Yarmouth County, Nova Scotia, Canada"
Mill Cove,44.5865807,-64.0633111,YHZ,"Mill Cove, Chester District Municipality, Lunenburg County, Nova Scotia, B0J 1T0, Canada"
Scotsville,46.1860109,-61.1564258,YPS,"Scotsville, Municipality of the County of Inverness, Inverness County, Nova Scotia, Canada"
Bella Bella,52.1625615,-128.145207,QBC,"Bella Bella, Area B (Bella Bella), Central Coast Regional District, British Columbia, V0T 1Z0, Canada"
Belfast,46.0785753,-62.8783952,YYG,"Belfast, Rural Municipality of Belfast, Queens County, Prince Edward Island, Canada"
East Broughton,46.216664,-71.075706,YQB,"East Broughton, Les Appalaches, Chaudière-Appalaches, Québec, Canada"
Lethbridge County,49.8420869,-112.678755,YQL,"Lethbridge County, Alberta, Canada"
Fergus,43.7059439,-80.3779366,YKF,"Fergus, Centre Wellington, Wellington County, Ontario, N1M 1P6, Canada"
Noëlville,46.133946,-80.4317083,YSB,"Noëlville, French River, Sudbury District, Northeastern Ontario, Ontario, P0M 2N0, Canada"
Woody Point,49.4958892,-57.9205885,YDF,"Woody Point, Newfoundland, Newfoundland and Labrador, Canada"
Saint-Nazaire,48.58543075,-71.53504211482783,YTF,"Saint-Nazaire, Lac-Saint-Jean-Est, Saguenay–Lac-Saint-Jean, Québec, G0W 2V0, Canada"
Upton,45.649014,-72.6935269,ZBM,"Upton, Acton, Montérégie, Québec, J0H 2E0, Canada"
North East Margaree,46.326314,-61.0087867,YQY,"North East Margaree, Municipality of the County of Inverness, Inverness County, Nova Scotia, B0E 2C0, Canada"
Yale,49.563655,-121.432004,YHE,"Yale, Area B (South Fraser Canyon/Sunshine Valley), Fraser Valley Regional District, British Columbia, V0K 2S0, Canada"
Grand Coulee,50.4327125,-104.8179606,YQR,"Grand Coulee, Division No. 6, Saskatchewan, Canada"
Bass River,45.4138767,-63.7794117,YHZ,"Bass River, Municipality of Colchester, Colchester County, Nova Scotia, B0M 1E0, Canada"
Dacre,45.3704116,-76.9659522,YTA,"Dacre, Greater Madawaska, Renfrew County, Eastern Ontario, Ontario, K0J 1N0, Canada"
Brome,45.189207,-72.5628566,ZBM,"Brome, Brome-Missisquoi, Estrie, Québec, Canada"
Alida,49.3889663,-101.8727438,YEN,"Alida, Division No. 1, Saskatchewan, Canada"
Gitwinksihlkw,55.1931199,-129.2222031,YXT,"Gitwinksihlkw, British Columbia, V0J 3T0, Canada"
Coutts,49.0017307,-111.9638892,CTB,"Village of Coutts, Alberta, Canada"
Ruisseau-à-Rebours,49.1860255,-65.956442,YME,"Ruisseau à Rebours, Rivière-à-Claude, La Haute-Gaspésie, Gaspésie–Îles-de-la-Madeleine, Québec, Canada"
Margaree Centre,46.3473854,-60.9991112,YQY,"Margaree Centre, Municipality of the County of Inverness, Inverness County, Nova Scotia, B0E 1Z0, Canada"
Knoydart,45.715457,-62.2426065,YPS,"Knoydart, Municipality of Pictou County, Pictou County, Nova Scotia, Canada"
Thurso,45.598185,-75.246048,YND,"Thurso, Papineau, Québec, Canada"
Cartwright,53.7062458,-57.0198174,YRF,"Cartwright, Labrador, Newfoundland and Labrador, Canada"
Lavaltrie-Station,45.9329102,-73.3804712,YHU,"Lavaltrie-Station, Saint-Paul, Joliette (MRC), Lanaudière, Québec, J5T 3L3, Canada"
Resolute,74.697029,-94.840851,YRB,"Resolute, ᕿᑭᖅᑖᓗᒃ Qikiqtaaluk Region, ᓄᓇᕗᑦ Nunavut, X0A 0V0, Canada"
Coleville,51.710641,-109.2452062,YKY,"Coleville, Division No. 13, Saskatchewan, Canada"
Renfrew,45.7300564,-77.2793698,YTA,"Renfrew County, Eastern Ontario, Ontario, Canada"
Saint-Georges-de-Windsor,45.6975674,-71.8432993,YSC,"Saint-Georges-de-Windsor, Les Sources, Estrie, Québec, Canada"
Prince Rupert,54.3126572,-130.32549,ZSW,"Prince Rupert, North Coast Regional District, British Columbia, Canada"
Saint-Adolphe-d'Howard,45.9713455,-74.3392745,YMX,"Saint-Adolphe-d'Howard, Les Pays-d'en-Haut, Laurentides, Québec, J0T 2B0, Canada"
Port Glasgow,42.510386,-81.6113477,YQS,"Port Glasgow, West Elgin, Elgin County, Ontario, Canada"
Burgeo,47.612504,-57.6095399,MQC,"Burgeo, Newfoundland, Newfoundland and Labrador, A0N 2H0, Canada"
Stony Plain,53.5310131,-113.9998496,YXD,"Stony Plain (town), Alberta, T7Z 2L6, Canada"
Rivière-la-Madeleine,49.238997,-65.3035347,YGP,"Rivière-la-Madeleine, Sainte-Madeleine-de-la-Rivière-Madeleine, La Haute-Gaspésie, Gaspésie–Îles-de-la-Madeleine, Québec, Canada"
Kenora (City),49.766215,-94.4893528,YQK,"Kenora, Kenora District, Northwestern Ontario, Ontario, Canada"
Latulipe-et-Gaboury,47.350873050000004,-79.02170407357227,YXR,"Latulipe-et-Gaboury, Québec, Canada"
Paspébiac,48.0294111,-65.2490836,YVB,"Paspébiac, Bonaventure (MRC), Gaspésie–Îles-de-la-Madeleine, Québec, G0C 2K0, Canada"
Seba Beach,53.5646481,-114.7297662,YXD,"Summer Village of Seba Beach, Alberta, Canada"
Wotton,45.737818,-71.807327,YSC,"Wotton, Les Sources, Estrie, Québec, J0A 1N0, Canada"
Red Deer,52.2690628,-113.8141464,YQF,"City of Red Deer, Division No. 8, Alberta, Canada"
Blanc-Sablon,51.4121624,-57.2018488,YBX,"Blanc-Sablon, Le Golfe-du-Saint-Laurent, Côte-Nord, Québec, Canada"
Dorchester,45.8992863,-64.5170033,YQM,"Dorchester, Dorchester Parish, Westmorland County, New Brunswick / Nouveau-Brunswick, E4K 2Y9, Canada"
Sainte-Catherine,45.40049,-73.576257,YUL,"Sainte-Catherine, Roussillon, Montérégie, Québec, Canada"
Saint Gregoire,46.2714553,-72.5115737,YRQ,"Saint-Grégoire, Bécancour, Bécancour (MRC), Centre-du-Québec, Québec, G9H 1M3, Canada"
Rusticoville,46.4327212,-63.3189046,YYG,"Rusticoville, Rustico, Lot 24, Queens County, Prince Edward Island, C0A 1X0, Canada"
Chelsea,45.5031737,-75.808023,YRO,"Chelsea, Les Collines-de-l'Outaouais, Québec, Canada"
New Aiyansh,55.2065347,-129.079518,YXT,"New Aiyansh, Gitksy'oon Avenue, Gitlaxt'aamiks, British Columbia, V0J 1A0, Canada"
L'Anse-au-Sac,47.5207995,-70.2084963,YML,"L'Anse-au-Sac, Saint-Irénée, Charlevoix-Est, Capitale-Nationale, Québec, G0T 1V0, Canada"
108 Mile Ranch,51.732467650000004,-121.36305191510529,ZMH,"108 Mile Ranch, Area G (Lac La Hache/108 Mile Ranch), Cariboo Regional District, British Columbia, Canada"
Ancaster,43.225693,-79.976692,YHM,"Ancaster, Hamilton, Golden Horseshoe, Ontario, L9G 2B9, Canada"
Metinota,53.0329362,-108.4132839,YQW,"Metinota, Division No. 17, Saskatchewan, Canada"
Airdrie,51.28597,-114.01062,YYC,"Airdrie, Alberta, Canada"
Candiac,45.3867947,-73.5163824,YHU,"Candiac, Roussillon, Montérégie, Québec, Canada"
Glooscap 35,45.0435394,-64.2314387,YZX,"Glooscap 35, Glooscap First Nation, Kings County, Nova Scotia, B0P 1P0, Canada"
Tilbury,42.2593155,-82.4322682,YQG,"Tilbury, Chatham-Kent, Ontario, N0P 2L0, Canada"
Saint-Léon-le-Grand (La Matapédia),48.380426,-67.504807,YME,"Saint-Léon-le-Grand, La Matapédia, Bas-Saint-Laurent, Québec, Canada"
L'Anse-au-Griffon,48.9305609,-64.2958742,YGP,"L'Anse-au-Griffon, Gaspé, La Côte-de-Gaspé, Gaspésie–Îles-de-la-Madeleine, Québec, G4X 6A6, Canada"
Saint Agatha,43.43820395,-80.60618944554349,YKF,"Saint Agatha Mennonite Church, 1967, Erb's Road, Wilmot, Region of Waterloo, Ontario, N0B 2L0, Canada"
Malagash,45.772101,-63.3766527,YYG,"Malagash, Upper Malagash, Municipality of the County of Cumberland, Cumberland County, Nova Scotia, B0K 1E0, Canada"
Carmanville,49.403825,-54.287567,YQX,"Carmanville, Newfoundland, Newfoundland and Labrador, Canada"
Saint-Côme,46.271037,-73.771477,YMX,"Saint-Côme, Matawinie, Lanaudière, Québec, Canada"
Tatogga,57.715114,-129.9871627,YDL,"Tatogga, Area D (Iskut/Big Raven), Regional District of Kitimat-Stikine, British Columbia, Canada"
Port Douglas,49.7719457,-122.1652451,YHE,"Port Douglas, Area C (Sasquatch Country), Fraser Valley Regional District, British Columbia, Canada"
Coldwater,44.7097402,-79.6439762,YLK,"Coldwater, Severn, Simcoe County, Central Ontario, Ontario, L0K 1E0, Canada"
Alvinston,42.8208904,-81.8696455,YZR,"Alvinston, Brooke-Alvinston, Lambton County, Ontario, N0N 1A0, Canada"
Hinchinbrooke,45.053870700000004,-74.09994113501622,YCC,"Hinchinbrooke, Le Haut-Saint-Laurent, Montérégie, Québec, Canada"
North Wiltshire,46.3014801,-63.333024,YYG,"North Wiltshire, Queens County, Prince Edward Island, C0A 1Y0, Canada"
Gore Bay,45.9167876,-82.4640868,YZE,"Gore Bay, Manitoulin District, Northeastern Ontario, Ontario, P0P 1H0, Canada"
Mackenzie,58.9632924,-116.8686471,YOJ,"Mackenzie County, Alberta, Canada"
St. Catharines,43.1579812,-79.2441003,YCM,"St. Catharines, Niagara Region, Golden Horseshoe, Ontario, Canada"
Egmont,49.7498134,-123.9319648,YPW,"Egmont, Area A (Egmont/Pender Harbour), Sunshine Coast Regional District, British Columbia, V0N 1N0, Canada"
Ucluelet,48.9426817,-125.5460498,YAZ,"Ucluelet, Alberni-Clayoquot Regional District, British Columbia, V0R 3A0, Canada"
Admirals Beach,47.0056499,-53.6425606,YYT,"Admirals Beach, Admiral's Beach, Newfoundland, Newfoundland and Labrador, Canada"
Hérouxville,46.677239,-72.617569,YRQ,"Hérouxville, Mékinac, Mauricie, Québec, G0X 1J0, Canada"
70 Mile House,51.3134959,-121.3936001,ZMH,"70 Mile House, Area E (Bonaparte Plateau), Thompson-Nicola Regional District, British Columbia, V0K 2K0, Canada"
Trout River,49.4799143,-58.1297164,YDF,"Trout River, Newfoundland, Newfoundland and Labrador, Canada"
Neguac,47.2469012,-65.0767222,YCH,"Neguac, Alnwick Parish, Northumberland County, New Brunswick / Nouveau-Brunswick, Canada"
Echo Bay,53.2124649,-107.1282483,YQW,"Echo Bay, Division No. 16, Saskatchewan, Canada"
Glace Bay,46.1949393,-59.9561999,YQY,"Glace Bay, Cape Breton Regional Municipality, Cape Breton County, Nova Scotia, Canada"
Cobalt,47.3962288,-79.6856668,YXR,"Cobalt, Timiskaming District, Northeastern Ontario, Ontario, Canada"
Lewisporte,49.246293,-55.059357,YQX,"Lewisporte, Newfoundland, Newfoundland and Labrador, A0G 3A0, Canada"
Saint-Donat,46.318718,-74.221916,YTM,"Saint-Donat, Matawinie, Lanaudière, Québec, J0T 2C0, Canada"
Lac-Bouchette,48.259427,-72.184296,YRJ,"Lac-Bouchette, Le Domaine-du-Roy, Saguenay–Lac-Saint-Jean, Québec, Canada"
North Rustico Harbour,46.44332545,-63.30390654628438,YYG,"North Rustico Harbour, Rustico, Lot 24, Queens County, Prince Edward Island, Canada"
Cavan,44.1996764,-78.4686767,YPQ,"Cavan, Cavan-Monaghan, Peterborough County, Central Ontario, Ontario, L0A 1C0, Canada"
Caroline,52.0943034,-114.7391684,YRM,"Caroline, Alberta, Canada"
West Point,46.6265286,-64.3718282,YSU,"West Point, Lot 8, Prince County, Prince Edward Island, Canada"
Saint-Herménégilde,45.105758,-71.672745,YSC,"Saint-Herménégilde, Coaticook (MRC), Estrie, Québec, Canada"
Enchant,50.166667,-112.416667,YQL,"Enchant, Municipal District of Taber, Alberta, Canada"
Cookshire-Eaton,45.380020849999994,-71.68420351005508,YSC,"Cookshire-Eaton, Le Haut-Saint-François, Estrie, Québec, Canada"
Vaughan (York),43.7941544,-79.5268023,YZD,"Vaughan, York Region, Golden Horseshoe, Ontario, Canada"
Gracefield,46.0933721,-76.0531906,YMW,"Gracefield, La Vallée-de-la-Gatineau, Québec, Canada"
Rolling Hills,50.2252023,-111.7729252,YSD,"Rolling Hills, County of Newell, Alberta, Canada"
Mitchell,43.467942,-81.197899,YCE,"Mitchell, West Perth, Perth County, Ontario, N0K 1N0, Canada"
Rivière-Éternité,48.2562717,-70.4149389,YBG,"Rivière-Éternité, Le Fjord-du-Saguenay, Saguenay–Lac-Saint-Jean, Québec, G0V 1P0, Canada"
Sainte-Aurélie,46.176027,-70.363312,YQB,"Sainte-Aurélie, Les Etchemins, Chaudière-Appalaches, Québec, G0M 1M0, Canada"
Middle Sackville,44.8014509,-63.7296755,YHZ,"Middle Sackville, Halifax Regional Municipality, Halifax County, Nova Scotia, Canada"
Rockingham,44.6760232,-63.6616731,YHZ,"Rockingham, Halifax, Halifax Regional Municipality, Halifax County, Nova Scotia, Canada"
Douro,44.3760543,-78.192366,YPQ,"Douro, Douro-Dummer, Peterborough County, Central Ontario, Ontario, K0L 1S0, Canada"
Canning,45.1577166,-64.4209904,YZX,"Canning, Municipality of the County of Kings, Kings County, Nova Scotia, B0P 1H0, Canada"
Saint John West,45.259035,-66.0777874,YSJ,"Saint John West, City of Saint John, Saint John County, New Brunswick / Nouveau-Brunswick, E2M 1G2, Canada"
La Tabatière,50.8337972,-58.9687809,ZLT,"La Tabatière, Gros-Mécatina, Le Golfe-du-Saint-Laurent, Côte-Nord, Québec, Canada"
Nanaimo,49.163877,-123.938122,ZNA,"Nanaimo, Regional District of Nanaimo, British Columbia, Canada"
Tobique First Nation,46.79676525,-67.69134150425607,CAR,"Tobique First Nation / Wolastoqiyik Neqotkuk, Tobique / Neqotkuk, Perth Parish, Victoria County, New Brunswick / Nouveau-Brunswick, E7H 3Y4, Canada"
Beaverdell,49.4343519,-119.0884516,YYF,"Beaverdell, Area E (Beaverdell/West Boundary), Regional District of Kootenay Boundary, British Columbia, Canada"
Vaudreuil-Soulanges,45.3781798,-74.2292199,YMX,"Vaudreuil-Soulanges, Montérégie, Québec, Canada"
Hoyt,45.0527012,-66.9092115,YSJ,"Hoyt Nub, Saint George Parish, Charlotte County, New Brunswick / Nouveau-Brunswick, Canada"
Long Harbour-Mount Arlington Heights,47.44858145,-53.76102552927817,YYT,"Long Harbour - Mount Arlington Heights, Newfoundland, Newfoundland and Labrador, Canada"
Caraquet,47.7909581,-64.9491778,YVB,"Caraquet, Caraquet Parish, Gloucester County, New Brunswick / Nouveau-Brunswick, Canada"
Saint-Dominique,45.565506,-72.854462,ZBM,"Saint-Dominique, Les Maskoutains, Montérégie, Québec, J0H 1L0, Canada"
Dalmeny,52.3448579,-106.7728666,YXE,"Dalmeny, Division No. 11, Saskatchewan, S0K 1E0, Canada"
Harvey Station,45.7300127,-67.0070398,YFC,"Harvey, Manners Sutton Parish, York County / Comté d'York, New Brunswick / Nouveau-Brunswick, Canada"
Rolla,55.8979789,-120.1398733,YDQ,"Rolla, Area D (Kiskatinaw Valley), Peace River Regional District, British Columbia, V0C 2G0, Canada"
Nakusp,50.2396111,-117.7974031,YRV,"Nakusp, Regional District of Central Kootenay, British Columbia, Canada"
Cormac,46.4070602,-63.0888806,YYG,"Cormac Crescent, Stanhope, Rural Municipality of North Shore, Queens County, Prince Edward Island, Canada"
Northampton,46.1078428,-67.48600923392857,HUL,"Northampton Parish, Carleton County, New Brunswick / Nouveau-Brunswick, Canada"
Fisher Branch,51.0826643,-97.6195724,YGM,"Fisher Branch, Rural Municipality of Fisher, Division No. 18, Manitoba, R0C 0Z0, Canada"
Calgary,51.0456064,-114.057541,YYC,"Calgary, Alberta, Canada"
Lac-aux-Sables,46.862069,-72.394753,YRQ,"Lac-aux-Sables, Mékinac, Mauricie, Québec, G0X 1M0, Canada"
Eel Ground,46.9670796,-65.6191992,YCH,"Eel Ground, Northesk Parish, Northumberland County, New Brunswick / Nouveau-Brunswick, E1V 4B6, Canada"
Mirror,52.4657704,-113.1077781,YQF,"Mirror, Division No. 8, Alberta, T0B 3C0, Canada"
Springbrook,52.1746648,-113.8716656,YQF,"Hamlet of Springbrook, Division No. 8, Alberta, Canada"
Kinnear Settlement,45.9769944,-65.2774369,YQM,"Kinnear Settlement, Salisbury Parish, Westmorland County, New Brunswick / Nouveau-Brunswick, Canada"
Notre-Dame-des-Érables,47.6382286,-65.2406203,ZBF,"Notre-Dame-des-Érables, Paquetville Parish, Gloucester County, New Brunswick / Nouveau-Brunswick, Canada"
New Tecumseth,44.1542367,-79.8689888,YLK,"New Tecumseth, Simcoe County, Central Ontario, Ontario, L9R 1A0, Canada"
Chetwynd,55.6958928,-121.6381789,YCQ,"Chetwynd, Peace River Regional District, British Columbia, V0C 1J0, Canada"
Sheenboro,45.9702782,-77.2325043,YWA,"Sheenboro, Pontiac, Outaouais, Québec, J0X 2Z0, Canada"
Campbell's Bay,45.7332686,-76.6015664,YTA,"Campbell's Bay, Québec, J0X 1K0, Canada"
Saint-Urbain-Premier,45.21905,-73.736801,YUL,"Saint-Urbain-Premier, Beauharnois-Salaberry, Montérégie, Québec, Canada"
Warren Grove,46.2776228,-63.2167054,YYG,"Warren Grove, Rural Municipality of Warren Grove, Queens County, Prince Edward Island, Canada"
Keene,44.2415629,-78.1620568,YPQ,"Keene, Otonabee–South Monaghan, Peterborough County, Central Ontario, Ontario, K0L 2G0, Canada"
Harbour Breton,47.4710255,-55.8257953,MQC,"Harbour Breton, Newfoundland, Newfoundland and Labrador, Canada"
Compton,45.243228,-71.827927,YSC,"Compton, Coaticook (MRC), Estrie, Québec, Canada"
Sainte-Euphémie-sur-Rivière-du-Sud,46.773731,-70.440216,YQB,"Sainte-Euphémie-sur-Rivière-du-Sud, Montmagny (MRC), Chaudière-Appalaches, Québec, Canada"
Blackstock,44.1074003,-78.8200172,YOO,"Blackstock, Scugog, Durham Region, Golden Horseshoe, Ontario, L0B 1B0, Canada"
Condor,52.3264216,-114.553047,YRM,"Condor, Census Division No. 9, Alberta, Canada"
Mascouche,45.7453521,-73.6005591,YHU,"Mascouche, Les Moulins, Lanaudière, Québec, Canada"
Waldheim,52.6186624,-106.649761,YXE,"Waldheim, Division No. 15, Saskatchewan, S0K 4R0, Canada"
Saint-Charles-de-Bellechasse,46.77232,-70.940781,YQB,"Saint-Charles-de-Bellechasse, Bellechasse, Chaudière-Appalaches, Québec, G0R 2T0, Canada"
Elkwater,49.6613715,-110.2823464,YXH,"Elkwater, Division No. 1, Alberta, T0J 1C0, Canada"
Tourelle,49.1607979,-66.4071974,YME,"Tourelle, Sainte-Anne-des-Monts, La Haute-Gaspésie, Gaspésie–Îles-de-la-Madeleine, Québec, Canada"
Manitouwadge,49.121541,-85.8384058,YMG,"Manitouwadge, Manitouwadge Township, Thunder Bay District, Northwestern Ontario, Ontario, P0T 2C0, Canada"
Mira Road,46.1088505,-60.160323,YQY,"Mira Road, Cape Breton Regional Municipality, Cape Breton County, Nova Scotia, Canada"
Glenella,50.557519,-99.1934671,YDN,"Glenella, Municipality of Glenella – Lansdowne, Division No. 8, Manitoba, Canada"
Lejac,54.0622374,-124.7613775,YXS,"Lejac, Area D (Endako/Fort Fraser), Regional District of Bulkley-Nechako, British Columbia, Canada"
"Saint-Jean-de-la-Lande, Quebec",47.4259269,-68.6794162,WFK,"Saint-Jean-de-la-Lande, Témiscouata, Bas-Saint-Laurent, Québec, Canada"
Saint-Roch-Ouest,45.8581354,-73.6535745,YMX,"Saint-Roch-Ouest, Montcalm, Lanaudière, Québec, Canada"
Port Renfrew,48.550251,-124.417419,YCD,"Port Renfrew, Juan de Fuca Electoral Area, Capital Regional District, British Columbia, V0S 1K0, Canada"
Stoney Creek,49.987939,-117.9585273,YCG,"Stoney Creek, Area K (The Arrow Lakes), Regional District of Central Kootenay, British Columbia, Canada"
Essa,44.2344356,-79.8063686586334,YLK,"Essa, Simcoe County, Central Ontario, Ontario, Canada"
Ladysmith,48.9936579,-123.8157964,YCD,"Ladysmith, Cowichan Valley Regional District, British Columbia, Canada"
Massey,46.2126468,-82.0771831,YEL,"Massey, Sables-Spanish Rivers Township, Sudbury District, Northeastern Ontario, Ontario, P0P 1P0, Canada"
Grande-Rivière,61.12989385,-117.16488036590948,YHY,"Mackenzie River, South Slave Region, Northwest Territories, Canada"
Fort Qu'Appelle,50.7719106,-103.7958877,YQR,"Fort Qu'Appelle, Division No. 6, Saskatchewan, S0G 1S0, Canada"
Masset,54.0124473,-132.1452236,ZMT,"Masset, North Coast Regional District, British Columbia, V0T 1M0, Canada"
Gogama,47.6736705,-81.7250895,YTS,"Gogama, Unorganized North Sudbury, Sudbury District, Northeastern Ontario, Ontario, Canada"
Chatham,42.4057219,-82.1853837,MTC,"Chatham, Chatham-Kent, Ontario, N7L 1S4, Canada"
Saint-Alexandre-de-Kamouraska,47.6832387,-69.6239716,YRI,"Saint-Alexandre-de-Kamouraska, Kamouraska (MRC), Bas-Saint-Laurent, Québec, Canada"
Carrot River,53.284101,-103.584595,YHB,"Carrot River, Division No. 14, Saskatchewan, S0E 0L0, Canada"
Huntsville,45.3263919,-79.218434,YQA,"Huntsville, District Municipality of Muskoka, Muskoka District, Central Ontario, Ontario, Canada"
