location,latitude,longitude,nearest_airport,full_address
Saint-Séverin,46.6660035,-72.5008541,YRQ,"Saint-Séverin, Mékinac, Mauricie, Québec, Canada"
Sioux Lookout,50.11345465,-92.19624322619077,YXL,"Sioux Lookout, Kenora District, Northwestern Ontario, Ontario, Canada"
Armstrong,50.302131,-89.0373698,YYW,"Armstrong, Unorganized Thunder Bay District, Thunder Bay District, Northwestern Ontario, Ontario, P0T 1A0, Canada"
Goodsoil,54.399722,-109.226111,YLJ,"Goodsoil, Division No. 17, Saskatchewan, S0M 1A0, Canada"
Sainte-Félicité,48.9010189,-67.3373897,YME,"Sainte-Félicité, La Matanie, Bas-Saint-Laurent, Québec, G0J 2K0, Canada"
Everett,44.1956091,-79.937746,YLK,"Everett, Adjala–Tosorontio, New Tecumseth, Simcoe County, Central Ontario, Ontario, L0M 1J0, Canada"
Jeannettes Creek,42.3251105,-82.3296761,YQG,"Jeannettes Creek, Chatham, Chatham-Kent, Ontario, Canada"
Bailieboro,44.132078,-78.3531591,YPQ,"Bailieboro, Cavan-Monaghan, Peterborough County, Central Ontario, Ontario, K0L 1B0, Canada"
Chesterville,45.962845,-71.822777,YSC,"Chesterville, Arthabaska, Centre-du-Québec, Québec, G0P 1J0, Canada"
Québec City,46.8137431,-71.2084061,YQB,"Québec, Agglomération de Québec, Capitale-Nationale, Québec, Canada"
Bonne Bay,49.508168749999996,-57.899047630280805,YDF,"Bonne Bay, Norris Point, Newfoundland, Newfoundland and Labrador, Canada"
Saint-Joseph,45.6346331,-72.9313889,YHU,"Saint-Joseph, Saint-Hyacinthe, Les Maskoutains, Montérégie, Québec, J2T 1A9, Canada"
Greenstone,49.7188752,-86.9493168,YGQ,"Greenstone, Thunder Bay District, Northwestern Ontario, Ontario, Canada"
Johnstown,45.8023517,-60.726862,YPS,"Johnstown, Municipality of the County of Richmond, Richmond County, Nova Scotia, Canada"
Arctic Bay,73.06317795000001,-85.02096980646908,YAB,"Arctic Bay, ᕿᑭᖅᑖᓗᒃ Qikiqtaaluk Region, ᓄᓇᕗᑦ Nunavut, Canada"
Wellington,43.7590121,-80.4614994,YKF,"Wellington County, Ontario, Canada"
West Nipissing,46.3265105,-80.1701683,YYB,"West Nipissing, Nipissing District, Northeastern Ontario, Ontario, Canada"
Cadotte Lake,56.4703963,-116.395035,YPE,"Cadotte Lake, Division No. 17, Alberta, Canada"
Marmora,44.4827759,-77.6823297,YTR,"Marmora, Marmora and Lake, Hastings County, Central Ontario, Ontario, K0K 2M0, Canada"
Saint-Georges-de-Clarenceville,45.0638913,-73.2479012,YJN,"Clarenceville, Le Haut-Richelieu, Montérégie, Québec, J0J 1B0, Canada"
M'Chigeeng Indian Reserve 22,45.807471,-82.1773246164727,YEM,"M'Chigeeng First Nation, M’Chigeeng, Manitoulin District, Northeastern Ontario, Ontario, P0P 1G0, Canada"
Alexandria,52.633333,-122.45,YQZ,"Alexandria, Area A (Red Bluff/Quesnel South), Cariboo Regional District, British Columbia, Canada"
Beiseker,51.3852192,-113.5383076,YYC,"Village of Beiseker, Alberta, T0M 0G0, Canada"
Long Point,42.5783996,-80.4405477,YQS,"Long Point, Norfolk County, Ontario, N0E 1M0, Canada"
Hebron,43.8874729,-66.090385,YQI,"Hebron, Yarmouth Municipal District, Yarmouth County, Nova Scotia, Canada"
Niverville,49.6044699,-97.0375954,YWG,"Niverville, Division No. 2, Manitoba, R0A 1E0, Canada"
Saint-Jean-de-Matha,46.230203,-73.534927,YRQ,"Saint-Jean-de-Matha, Matawinie, Lanaudière, Québec, J0K 2S0, Canada"
Beaverlodge,55.2106188,-119.4286716,YQU,"Beaverlodge, Division No. 19, Alberta, T0H 0C0, Canada"
Biggar,52.0576499,-107.984618,YQW,"Biggar, Division No. 12, Saskatchewan, S0K 0M0, Canada"
Shipshaw,48.4598044,-71.2609844,YBG,"Shipshaw, Arrondissement de Jonquière, Saguenay, Saguenay–Lac-Saint-Jean, Québec, G7P 1H5, Canada"
Upper Rawdon,45.0680737,-63.7128109,YHZ,"Upper Rawdon, East Hants District Municipality, Hants County, Nova Scotia, B0N 2N0, Canada"
Mancebourg,48.7490235,-79.2992254,YUY,"Sainte-Hélène-de-Mancebourg, Abitibi-Ouest, Québec, Canada"
Thedford,43.1639393,-81.8529319,YCE,"Thedford, Lambton Shores, Lambton County, Ontario, N0M 2N0, Canada"
Divide,49.1492019,-109.1284296,HVR,"Divide, Frontier No. 19, Division No. 4, Saskatchewan, Canada"
Borden,62.4517843,-114.4213212,YZF,"Borden, Yellowknife, North Slave Region, Northwest Territories, Canada"
Saint-Quentin,47.5129555,-67.3906756,YSL,"Saint-Quentin, Saint Quentin Parish, Restigouche County, New Brunswick / Nouveau-Brunswick, E8A 1H5, Canada"
Maitland Bridge,44.4486318,-65.2019826,YDG,"Maitland Bridge, Municipality of the County of Annapolis, Annapolis County, Nova Scotia, B0T 1N0, Canada"
Tiverton,44.3886196,-66.2138548,YDG,"Tiverton, Digby Municipal District, Digby County, Nova Scotia, B0V 1G0, Canada"
Saint-Mathieu-de-Beloeil,45.6044349,-73.2492469,YHU,"Saint-Mathieu-de-Beloeil, La Vallée-du-Richelieu, Montérégie, Québec, Canada"
Stanley,46.2830621,-66.741204,YFC,"Stanley, Stanley Parish, York County / Comté d'York, New Brunswick / Nouveau-Brunswick, Canada"
Boyle,54.590833,-112.809167,YXD,"Village of Boyle, Alberta, Canada"
Maces Bay,45.10411155,-66.53690625134882,YSJ,"Maces Bay, New River Island, Lepreau Parish, Charlotte County, New Brunswick / Nouveau-Brunswick, Canada"
Silverton,50.7689581,-101.1621706,YDN,"Silverton, Rural Municipality of Riding Mountain West, Division No. 16, Manitoba, Canada"
Saint Mary's,45.9673317,-66.61770960376343,YFC,"Saint Mary's, 780, Rue McEvoy Street, Neill Brae, Devon, Fredericton, York County / Comté d'York, New Brunswick / Nouveau-Brunswick, E3A 9M1, Canada"
Belyeas Cove,45.7176218,-66.0123241,YFC,"Belyeas Cove, Wickham Parish, Queens County, New Brunswick / Nouveau-Brunswick, Canada"
Hixon,53.4172584,-122.5818723,YQZ,"Hixon, Area E (Woodpecker/Hixon), Regional District of Fraser-Fort George, British Columbia, V0K 1S0, Canada"
Montcerf-Lytton,46.537137,-76.04393,YMW,"Montcerf-Lytton, La Vallée-de-la-Gatineau, Québec, J0W 1N0, Canada"
Harriston,44.757818,-64.4652559,YZX,"Harriston, Chester District Municipality, Lunenburg County, Nova Scotia, Canada"
Saint-Gabriel-de-Valcartier,46.93573,-71.468468,YQB,"Saint-Gabriel-de-Valcartier, La Jacques-Cartier, Capitale-Nationale, Québec, G0A 4S0, Canada"
Andrew,53.8798431,-112.3313018,YXD,"Village of Andrew, Division No. 10, Alberta, T0B 0C0, Canada"
Chambord,48.4306817,-72.0631082,YRJ,"Chambord, Le Domaine-du-Roy, Saguenay–Lac-Saint-Jean, Québec, Canada"
Sainte-Eulalie,46.111802,-72.250557,YRQ,"Sainte-Eulalie, Nicolet-Yamaska, Centre-du-Québec, Québec, G0Z 1G0, Canada"
Utopia,45.1479664,-66.7712324,YSJ,"Utopia, Saint George Parish, Charlotte County, New Brunswick / Nouveau-Brunswick, E5C 2K3, Canada"
Niton Junction,53.6186298,-115.769706,YET,"Niton Junction, Division No. 14, Alberta, T0E 1S0, Canada"
Saint John East,45.2877989,-66.0406597,YSJ,"Saint John East, City of Saint John, Saint John County, New Brunswick / Nouveau-Brunswick, E2J 2E3, Canada"
Coachman's Cove,50.06331,-56.116791,YDF,"Coachman's Cove, Newfoundland, Newfoundland and Labrador, Canada"
Acme,51.4976077,-113.5109818,YYC,"Acme, Division No. 5, Alberta, T0M 0A0, Canada"
Mohawk Meadows,43.2316309,-79.9580726,YHM,"Mohawk Meadows, Hamilton, Golden Horseshoe, Ontario, L9G 3T7, Canada"
Sainte-Claire,46.600629,-70.864906,YQB,"Sainte-Claire, Bellechasse, Chaudière-Appalaches, Québec, G0R 2V0, Canada"
Brussels,43.7433558,-81.2506263,YCE,"Brussels, Huron East, Huron County, Ontario, N0G 1H0, Canada"
Toledo,44.7401804,-75.9952533,YSH,"Toledo, Elizabethtown-Kitley, Leeds and Grenville Counties, Eastern Ontario, Ontario, K0E 1Y0, Canada"
Saint-Norbert,46.1698417,-73.3147505,YRQ,"Saint-Norbert, D'Autray, Lanaudière, Québec, J0K 3C0, Canada"
Enfield,44.9475484,-63.5962058,YHZ,"Enfield, Halifax Regional Municipality, Halifax County, Nova Scotia, B2T 1H9, Canada"
Bryson,45.6772459,-76.6217075,YTA,"Bryson, Québec, J0X 1H0, Canada"
Spallumcheen,50.4024484,-119.2175407,YVE,"Spallumcheen, Regional District of North Okanagan, British Columbia, V0E 1B2, Canada"
Dovercourt,53.5751216,-113.559188,YXD,"Dovercourt, Western Mature Area, Division No. 11, Alberta, Canada"
Ingonish,46.6919007,-60.3675452,YQY,"Ingonish, Municipality of Victoria County, Victoria County, Nova Scotia, B0C 1K0, Canada"
St-Armand,45.032774,-73.043976,YJN,"Saint-Armand, Brome-Missisquoi, Estrie, Québec, Canada"
Caronport,50.4561945,-105.8166586,YMJ,"Caronport, Division No. 7, Saskatchewan, S0H 0S0, Canada"
Fraser Lake,54.0602917,-124.843962,YXS,"Fraser Lake, Regional District of Bulkley-Nechako, British Columbia, Canada"
Elk Point,53.8999368,-110.8999785,YBY,"Elk Point, Division No. 12, Alberta, T0A 0B9, Canada"
Parkhill,43.1622799,-81.6842168,YCE,"Parkhill, North Middlesex, Middlesex County, Ontario, N0M 2K0, Canada"
Quesnel,52.9794279,-122.493627,YQZ,"Quesnel, Cariboo Regional District, British Columbia, Canada"
Orangeville,43.9193171,-80.0973754,YYZ,"Orangeville, Dufferin County, Central Ontario, Ontario, Canada"
Valleyfield,46.1436432,-62.6804255543062,YYG,"Valleyfield, Town of Three Rivers, Kings County, Prince Edward Island, Canada"
Caraquet (Town),47.7909581,-64.9491778,YVB,"Caraquet, Caraquet Parish, Gloucester County, New Brunswick / Nouveau-Brunswick, Canada"
Tofino,49.1529643,-125.9047083,YAZ,"Tofino, Alberni-Clayoquot Regional District, British Columbia, V0R 2Z0, Canada"
Portapique,45.4064651,-63.7105752,YHZ,"Portapique, Municipality of Colchester, Colchester County, Nova Scotia, Canada"
Strathroy,42.966146,-81.59100834347846,YCE,"Strathroy (Blue Yonder) Airport, McEvoy Road, Strathroy, Strathroy-Caradoc, Middlesex County, Ontario, N7G 4K6, Canada"
Leamington,42.0531166,-82.5996998,YQG,"Leamington, Essex County, Ontario, Canada"
Saint-Adrien,45.8201673,-71.7213076,YSC,"Saint-Adrien, Les Sources, Estrie, Québec, Canada"
Saint-Raymond,46.889058,-71.835136,YQB,"Saint-Raymond, Portneuf (MRC), Capitale-Nationale, Québec, Canada"
Tizzard's Harbour,49.5937393,-54.8032787,YQX,"Tizzard's Harbour, Newfoundland, Newfoundland and Labrador, Canada"
Millville Boularderie,46.27171,-60.3405168,YQY,"Millville Boularderie, Millville, Cape Breton Regional Municipality, Cape Breton County, Nova Scotia, B1Y 2N5, Canada"
Oakville,43.447436,-79.666672,YYZ,"Oakville, Halton Region, Golden Horseshoe, Ontario, Canada"
Semans,51.4059425,-104.7303424,YQR,"Semans, Division No. 10, Saskatchewan, S0A 3S0, Canada"
Dorset,45.2438734,-78.8939357,YQA,"Dorset, District Municipality of Muskoka, Muskoka District, Central Ontario, Ontario, P0A 1E0, Canada"
Shaunavon,49.6507703,-108.410021,YYN,"Shaunavon, Division No. 4, Saskatchewan, S0N 2M0, Canada"
Cranbrook,49.5107477,-115.7672772,YXC,"Cranbrook, Regional District of East Kootenay, British Columbia, Canada"
Baie-Comeau,49.2118373,-68.1801406,YBC,"Baie-Comeau, Manicouagan, Côte-Nord, Québec, Canada"
Mont-Laurier,46.5524071,-75.4968899,YMW,"Mont-Laurier, Antoine-Labelle, Laurentides, Québec, Canada"
Sainte-Émélie-de-l'Énergie,46.322986,-73.643417,YRQ,"Sainte-Émélie-de-l'Énergie, Matawinie, Lanaudière, Québec, Canada"
Winnipegosis,51.6479408,-99.9272871,YDN,"Winnipegosis, Division No. 17, Manitoba, Canada"
Honfleur,46.653914,-70.884132,YQB,"Honfleur, Bellechasse, Chaudière-Appalaches, Québec, G0R 1N0, Canada"
Heatherton,45.5880513,-61.7920332,YPS,"Heatherton, Municipality of the County of Antigonish, Antigonish County, Nova Scotia, Canada"
Woodbridge,43.7848982,-79.5923855,YZD,"Woodbridge, Vaughan, York Region, Golden Horseshoe, Ontario, L4L 9L9, Canada"
Thomasburg,44.391652,-77.3469096,YTR,"Thomasburg, Tweed, Hastings County, Central Ontario, Ontario, K0K 3H0, Canada"
Saint Teresa,46.28208,-62.7437166,YYG,"Saint Teresa, Town of Three Rivers, Kings County, Prince Edward Island, Canada"
Mahone Bay,44.4488931,-64.387173,YZX,"Town of Mahone Bay, Lunenburg County, Nova Scotia, Canada"
Grand Manan,44.6852981,-66.78930237650158,YDG,"Village of Grand Manan, Charlotte County, New Brunswick / Nouveau-Brunswick, Canada"
Colinet,47.2197757,-53.5524529,YYT,"Colinet, Newfoundland, Newfoundland and Labrador, Canada"
Champney's West,48.3828111,-53.3009051,YYT,"Champney's West, Newfoundland, Newfoundland and Labrador, A0C 2H0, Canada"
Seal Cove,47.4842856,-56.0623469,MQC,"Seal Cove, Newfoundland, Newfoundland and Labrador, Canada"
Desbarats,46.346326,-83.9229137,DRE,"Desbarats, Johnson Township, Algoma District, Northeastern Ontario, Ontario, P0R 1E0, Canada"
Martensville,52.2903172,-106.662554,YXE,"Martensville, Division No. 11, Saskatchewan, Canada"
Doaktown,46.5574196,-66.1311055,YCH,"Doaktown, Blissfield Parish, Northumberland County, New Brunswick / Nouveau-Brunswick, Canada"
Tobin Lake,53.5177764,-103.7420951,YHB,"Tobin Lake, Division No. 14, Saskatchewan, Canada"
Deschambault,46.6492,-71.929893,YQB,"Deschambault, Deschambault-Grondines, Portneuf (MRC), Capitale-Nationale, Québec, G0A 1S0, Canada"
Maniwaki,46.3778839,-75.9807967,YMW,"Maniwaki, La Vallée-de-la-Gatineau, Québec, Canada"
Langley Township,49.1202942,-122.659331,YLY,"Township of Langley, Metro Vancouver Regional District, British Columbia, Canada"
Osoyoos,49.033333,-119.466667,YYF,"Osoyoos, Regional District of Okanagan-Similkameen, British Columbia, Canada"
Meadows,48.9936523,-58.0558122,YDF,"Meadows, Newfoundland, Newfoundland and Labrador, Canada"
Muncey,42.7877929,-81.4749303,YQS,"Muncey / Nalahii, Middlesex County, Ontario, N0L 1Y0, Canada"
Hartfield,43.593202700000006,-80.30929792901809,YKF,"Hartfield, Guelph/Eramosa, Wellington County, Ontario, Canada"
Pierrefonds,45.4955083,-73.8471749,YUL,"Pierrefonds-Roxboro, Montréal, Agglomération de Montréal, Montréal (région administrative), Québec, Canada"
Senneterre (Paroisse),48.36814095,-77.27421251906762,YVO,"Senneterre (paroisse), La Vallée-de-l'Or, Québec, Canada"
Cannington,44.3502068,-79.038628,YLK,"Cannington, Brock, Durham Region, Golden Horseshoe, Ontario, L0E 1E0, Canada"
Saint Peters,46.4191102,-62.5817788,YYG,"Saint Peters, Rural Municipality of St. Peters, Kings County, Prince Edward Island, C0A 2A0, Canada"
Cape Wolfe,46.7209017,-64.3932349,YSU,"Cape Wolfe, Lot 7, Prince County, Prince Edward Island, Canada"
Fossambault-sur-le-Lac,46.871928,-71.6185,YQB,"Fossambault-sur-le-Lac, La Jacques-Cartier, Capitale-Nationale, Québec, G3N 1X7, Canada"
Banff,51.175076,-115.5720773,YBA,"Banff, Alberta, Canada"
Old Perlican,48.0874982,-53.0028753,YYT,"Old Perlican, Newfoundland, Newfoundland and Labrador, Canada"
Acadieville,46.7291233,-65.2658818,YCH,"Acadieville, Acadieville Parish, Kent County, New Brunswick / Nouveau-Brunswick, Canada"
Langdale,49.4340961,-123.4743017,CXH,"Langdale, Area F (West Howe Sound), Sunshine Coast Regional District, British Columbia, V0N 1V9, Canada"
Rivière-à-Pierre,46.9917209,-72.1802115,YQB,"Rivière-à-Pierre, Portneuf (MRC), Capitale-Nationale, Québec, G0A 3A0, Canada"
Vittoria,42.7624226,-80.323385,YHM,"Vittoria, Norfolk County, Ontario, N0E 1W0, Canada"
La Tuque,47.441092,-72.78511,YRQ,"La Tuque, Agglomération de La Tuque, Mauricie, Québec, Canada"
Seaforth,44.6724025,-63.2624061,YHZ,"Seaforth, Halifax Regional Municipality, Halifax County, Nova Scotia, Canada"
Wemotaci,47.9024882,-73.785114,YRJ,"Wemotaci, Mauricie, Québec, G0X 3R0, Canada"
Sainte-Brigide-d'Iberville,45.3232056,-73.0651582,YJN,"Sainte-Brigide-d'Iberville, Le Haut-Richelieu, Montérégie, Québec, J0J 1X0, Canada"
Anjou,45.6048982,-73.5466723,YHU,"Anjou, Montréal, Agglomération de Montréal, Montréal (région administrative), Québec, Canada"
Sillikers,46.9476026,-65.8758666,YCH,"Sillikers, Southesk Parish, Northumberland County, New Brunswick / Nouveau-Brunswick, E9E 1T3, Canada"
Warburg,53.1846146,-114.3181098,YEG,"Warburg, Division No. 11, Alberta, T0C 2T0, Canada"
Kettle Point,43.2153133,-82.0169809,YZR,"Kettle Point, Lambton County, Ontario, N0N 1J1, Canada"
Penetanguishene,44.7688035,-79.9339487,YLK,"Penetanguishene, Simcoe County, Central Ontario, Ontario, Canada"
Pangnirtung,66.1480197,-65.7172826,YXP,"ᐸᖕᓂᖅᑑᖅ Pangnirtung, ᕿᑭᖅᑖᓗᒃ Qikiqtaaluk Region, ᓄᓇᕗᑦ Nunavut, Canada"
Nordegg,52.4737361,-116.073132,YRM,"Nordegg, Clearwater County, Alberta, T0M 2H0, Canada"
Braeside,50.9557843,-114.1068165,YYC,"Braeside, Calgary, Alberta, T2W 0K1, Canada"
Deep Bay,56.4077709,-102.9878157,YYL,"Deep Bay, Unorganized Division No. 18, Division No. 18, Saskatchewan, Canada"
Mossley,42.9461871,-81.0118286,YXU,"Mossley, Thames Centre, Middlesex County, Ontario, N0L 1G6, Canada"
Eatonia,51.2241821,-109.3900359,YKY,"Eatonia, Division No. 8, Saskatchewan, S0L 0Y0, Canada"
Ottawa East,45.40851405,-75.67673303541713,YRO,"Old Ottawa East, (Old) Ottawa, Ottawa, Eastern Ontario, Ontario, Canada"
Suffield,50.2192746,-111.1608664,YSD,"Suffield, Cypress County, Alberta, T0J 2N0, Canada"
Cornwall Island,77.626125,-94.83756249999999,YRB,"Cornwall Island, ᓄᓇᕗᑦ Nunavut, Canada"
The Blue Mountains,44.5616963,-80.4501139,YOS,"The Blue Mountains, Grey County, Ontario, N0H 2P0, Canada"
North Augusta,44.7612581,-75.738843,OGS,"North Augusta, Augusta, Leeds and Grenville Counties, Eastern Ontario, Ontario, K0G 1R0, Canada"
Whitby,43.87982,-78.9421751,YOO,"Whitby, Durham Region, Golden Horseshoe, Ontario, Canada"
Saint-Jean-de-Dieu,48.0030719,-69.0470105,YRI,"Saint-Jean-de-Dieu, Les Basques, Bas-Saint-Laurent, Québec, Canada"
Oro-Medonte,44.5445701,-79.54891085886374,YLK,"Oro-Medonte, Simcoe County, Central Ontario, Ontario, Canada"
Breadalbane,46.3576099,-63.5008749,YSU,"Breadalbane, Queens County, Prince Edward Island, Canada"
Whistler Creek,50.0800354,-122.9663864,YWS,"Whistler Creek, Nordic, Whistler Resort Municipality, Squamish-Lillooet Regional District, British Columbia, Canada"
Sundre,51.7971316,-114.6394148,YQF,"Sundre, Town of Sundre, Alberta, T0M 1X0, Canada"
Louisdale,45.6115503,-61.0647382,YPS,"Louisdale, Municipality of the County of Richmond, Richmond County, Nova Scotia, B0E 1V0, Canada"
Naufrage,46.4673837,-62.4165112,YYG,"Naufrage, Saint Margarets, Kings County, Prince Edward Island, Canada"
Saint-Lambert,45.5016203,-73.5102981,YHU,"Saint-Lambert, Agglomération de Longueuil, Montérégie, Québec, Canada"
Oka,45.4612534,-74.0905549,YMX,"Oka, Deux-Montagnes (MRC), Laurentides, Québec, J0N 1E0, Canada"
North Harbour,47.8488463,-54.09105106194356,YYT,"North Harbour, Swift Current, Newfoundland, Newfoundland and Labrador, Canada"
Summerside,46.394306,-63.789368,YSU,"Summerside, City of Summerside, Prince County, Prince Edward Island, Canada"
Summerford,49.500242,-54.780579,YQX,"Summerford, Newfoundland, Newfoundland and Labrador, A0G 4E0, Canada"
Swalwell,50.05313715,-119.22703618785513,YLW,"Swalwell Lake, East Central Okanagan Electoral Area, Regional District of Central Okanagan, British Columbia, Canada"
Kingsport,45.1607771,-64.3619952,YZX,"Kingsport, Municipality of the County of Kings, Kings County, Nova Scotia, B0P 1T0, Canada"
Pinantan Lake,50.7301304,-120.0338638,YKA,"Pinantan Lake, Area P (Rivers and the Peaks), Thompson-Nicola Regional District, British Columbia, V0E 3E0, Canada"
Cardiff,53.7746507,-113.595499,YXD,"Cardiff, Division No. 11, Alberta, T8R 1S1, Canada"
Louis Creek,50.7963074,-119.9150712,YKA,"Louis Creek, Area P (Rivers and the Peaks), Thompson-Nicola Regional District, British Columbia, Canada"
Sainte-Angèle-de-Monnoir,45.3905068,-73.1081605,YJN,"Sainte-Angèle-de-Monnoir, Rouville, Montérégie, Québec, J0L 1P0, Canada"
La Patrie,45.4019276,-71.2498748,YSC,"La Patrie, Le Haut-Saint-François, Estrie, Québec, J0B 1Y0, Canada"
Bromont,45.3187339,-72.6463074,ZBM,"Bromont, Brome-Missisquoi, Estrie, Québec, Canada"
Landrienne,48.5471342,-77.9518173,YEY,"Landrienne, Abitibi, Québec, Canada"
Kindersley,51.4687094,-109.1581355,YKY,"Kindersley, Division No. 13, Saskatchewan, S0L 1S0, Canada"
Sainte-Christine,45.615478,-72.4288684,ZBM,"Sainte-Christine, Acton, Montérégie, Québec, Canada"
Ripon,45.7831185,-75.0997632,YND,"Ripon, Papineau, Québec, Canada"
Cumberland,45.6834902,-64.1938061,YQM,"Cumberland County, Nova Scotia, Canada"
Deer Lake,49.1830366,-57.4320002,YDF,"Deer Lake, Newfoundland, Newfoundland and Labrador, Canada"
Saint-Donat (Matawinie),46.318718,-74.221916,YTM,"Saint-Donat, Matawinie, Lanaudière, Québec, J0T 2C0, Canada"
Deschambault-Grondines,46.6462181,-72.0104373446065,YQB,"Deschambault-Grondines, Portneuf (MRC), Capitale-Nationale, Québec, G0A 1S0, Canada"
Egbert,45.2854249,-66.0459578,YSJ,"Egbert Street, Saint John East, City of Saint John, Saint John County, New Brunswick / Nouveau-Brunswick, E2J 1W9, Canada"
High River,50.5801916,-113.8709332,YYC,"High River, Town of High River, Alberta, T1V 1R6, Canada"
James River,45.5703064,-62.1314351,YPS,"James River, Municipality of the County of Antigonish, Antigonish County, Nova Scotia, Canada"
Meat Cove,47.0263819,-60.5591572,YGR,"Meat Cove, Municipality of the County of Inverness, Inverness County, Nova Scotia, B0C 1E0, Canada"
Kirkland,45.4529194,-73.8647559,YUL,"Kirkland, Agglomération de Montréal, Montréal (région administrative), Québec, Canada"
Enterprise,50.3504959,-109.886278,YXH,"Enterprise No. 142, Division No. 8, Saskatchewan, Canada"
Palmer Road,46.9126713,-64.1584622,YSU,"Palmer Road, Prince County, Prince Edward Island, Canada"
Inverness,46.1681871,-61.2197425,YPS,"Inverness County, Nova Scotia, Canada"
Saint-Aubert,47.180379,-70.219803,YML,"Saint-Aubert, L'Islet (MRC), Chaudière-Appalaches, Québec, G0R 2R0, Canada"
Saint-Louis,46.80754279999999,-64.89278100436337,YCH,"Saint-Louis, Kent County, New Brunswick / Nouveau-Brunswick, Canada"
Truro,45.366668,-63.300006,YHZ,"Truro, Town of Truro, Colchester County, Nova Scotia, Canada"
Meziadin Junction,56.1002202,-129.3064174,ZST,"Meziadin Junction, Area A (Nass Valley/Bell Irving), Regional District of Kitimat-Stikine, British Columbia, Canada"
Clair,47.2526505,-68.6033696,WFK,"Clair, Clair Parish, Madawaska County, New Brunswick / Nouveau-Brunswick, Canada"
Saint-Marc-sur-Richelieu,45.6771865,-73.1940958,YHU,"Saint-Marc-sur-Richelieu, La Vallée-du-Richelieu, Montérégie, Québec, J0L 2E0, Canada"
Lac la Hache,47.286231099999995,-70.95626431220104,YQB,"Lac la Hache, Lac-Jacques-Cartier, La Côte-de-Beaupré, Capitale-Nationale, Québec, Canada"
Wentworth-Nord,45.833802500000004,-74.47034247027358,YMX,"Wentworth-Nord, Les Pays-d'en-Haut, Laurentides, Québec, J0T 1Y0, Canada"
Cobble Hill,48.683708,-123.600311,YYJ,"Cobble Hill, Area C (Cobble Hill), Cowichan Valley Regional District, British Columbia, V0R 1L5, Canada"
Rivière-à-Claude,49.15216075,-65.87309048582713,YGP,"Rivière-à-Claude, La Haute-Gaspésie, Gaspésie–Îles-de-la-Madeleine, Québec, Canada"
Ellerslie,53.4198935,-113.464767,YEG,"Ellerslie, Edmonton, Division No. 11, Alberta, Canada"
Onanole,50.6235548,-99.9690366,YDN,"Onanole, Municipality of Harrison Park, Division No. 15, Manitoba, R0J 1N0, Canada"
Saulnierville,44.2659356,-66.130672,YDG,"Saulnierville, Clare Municipal District, Digby County, Nova Scotia, B0W 2Z0, Canada"
Saint-Henri-de-Taillon,48.6630869,-71.8250792,YTF,"Saint-Henri-de-Taillon, Lac-Saint-Jean-Est, Saguenay–Lac-Saint-Jean, Québec, Canada"
Picadilly,45.713419,-65.4001895,YSJ,"Picadilly, Cardwell Parish, Kings County, New Brunswick / Nouveau-Brunswick, E4E 5J5, Canada"
Bruno,52.2663037,-105.5189092,YXE,"Bruno, Division No. 15, Saskatchewan, S0K 0S0, Canada"
Concord,45.452798,-62.7905136,YHZ,"Concord, Municipality of Pictou County, Pictou County, Nova Scotia, Canada"
Moonstone,44.6502303,-79.6765713,YLK,"Moonstone, Oro-Medonte, Simcoe County, Central Ontario, Ontario, Canada"
Mantua,45.003172,-64.0454923,YHZ,"Mantua, Region of Windsor and West Hants Municipality, Hants County, Nova Scotia, Canada"
Oyster Bed Bridge,46.388544,-63.2372831,YYG,"Oyster Bed Bridge, Lot 24, Queens County, Prince Edward Island, Canada"
Agassiz,49.233333,-121.766667,YCW,"Agassiz, Kent, Fraser Valley Regional District, British Columbia, V0M 1A2, Canada"
Canim Lake,51.7691412,-120.8982861,ZMH,"Canim Lake, Area H (Canim Lake/Forest Grove), Cariboo Regional District, British Columbia, V0K 1J0, Canada"
Alberton,46.8127482,-64.0649989,YSU,"Alberton, Town of Alberton, Prince County, Prince Edward Island, C0B 1B0, Canada"
Saint-Michel (Montréal),45.5683244,-73.61713169190347,YUL,"Saint-Michel, Montréal, Agglomération de Montréal, Montréal (région administrative), Québec, Canada"
Sainte-Hénédine,46.559332,-70.984383,YQB,"Sainte-Hénédine, La Nouvelle-Beauce, Chaudière-Appalaches, Québec, G0S 2R0, Canada"
Stump Lake,45.71908145,-60.71794508666211,YPS,"Stump Lake, Soldiers Cove, Municipality of the County of Richmond, Richmond County, Nova Scotia, Canada"
Chatham (Chatham-Kent),42.4057219,-82.1853837,MTC,"Chatham, Chatham-Kent, Ontario, N7L 1S4, Canada"
Sabrevois,45.2067857,-73.2294969,YJN,"Sainte-Anne-de-Sabrevois, Le Haut-Richelieu, Montérégie, Québec, J0J 2G0, Canada"
Stony Mountain,60.1335322,-135.0359865,YXY,"Stony Mountain, Yukon, Canada"
Déléage,46.3807098,-75.9190778,YMW,"Déléage, La Vallée-de-la-Gatineau, Québec, J9E 2V9, Canada"
Sainte-Lucie-des-Laurentides,46.1294159,-74.1803062,YMX,"Sainte-Lucie-des-Laurentides, Les Laurentides, Laurentides, Québec, Canada"
Titusville,45.4856715,-65.7475636,YSJ,"Titusville, Upham Parish, Kings County, New Brunswick / Nouveau-Brunswick, Canada"
Lemberg,50.7256889,-103.2045147,YQV,"Lemberg, Division No. 5, Saskatchewan, S0A 2B0, Canada"
Sainte-Adèle,45.951895,-74.1359579,YMX,"Sainte-Adèle, Les Pays-d'en-Haut, Laurentides, Québec, Canada"
Saint-Laurent-de-l'Île-d'Orléans,46.8602081,-71.0065238,YQB,"Saint-Laurent-de-l'Île-d'Orléans, L'Ïle-d'Orléans, Capitale-Nationale, Québec, G0A 3Z0, Canada"
Gros-Morne,49.5940076,-57.7838788,YDF,"Gros Morne, Newfoundland, Newfoundland and Labrador, Canada"
King's Point,49.589349,-56.181335,YDF,"King's Point, Newfoundland, Newfoundland and Labrador, A0J 1H0, Canada"
Odanak,46.0729598,-72.8149608,YRQ,"Odanak, Centre-du-Québec, Québec, J0G 1H0, Canada"
